{
  "$schema": "./schemas/doc-config.schema.json",
  "version": "1.0",
  "spec": "moonbit",
  "output": {
    "format": "markdown",
    "filename": "README.mbt.md"
  },
  "packages": [
    {
      "path": "cmd/indexion/explore",
      "title": "explore",
      "include_in_root": true,
      "sections": ["overview", "usage"]
    },
    {
      "path": "cmd/indexion/grep",
      "title": "grep",
      "include_in_root": true,
      "sections": ["overview", "usage"]
    },
    {
      "path": "cmd/indexion/search",
      "title": "search",
      "include_in_root": true,
      "sections": ["overview", "usage"]
    },
    {
      "path": "cmd/indexion/similarity",
      "title": "sim",
      "include_in_root": true,
      "sections": ["overview", "usage"]
    },
    {
      "path": "cmd/indexion/segment",
      "title": "segment",
      "include_in_root": true,
      "sections": ["overview", "usage"]
    },
    {
      "path": "cmd/indexion/doc/graph",
      "title": "doc graph",
      "include_in_root": true,
      "sections": ["overview", "usage"]
    },
    {
      "path": "cmd/indexion/doc/readme",
      "title": "doc readme",
      "include_in_root": true,
      "sections": ["overview", "usage"]
    },
    {
      "path": "cmd/indexion/plan/refactor",
      "title": "plan refactor",
      "include_in_root": true,
      "sections": ["overview", "usage"]
    },
    {
      "path": "cmd/indexion/plan/documentation",
      "title": "plan documentation",
      "include_in_root": true,
      "sections": ["overview", "usage"]
    },
    {
      "path": "cmd/indexion/plan/readme",
      "title": "plan readme",
      "include_in_root": true,
      "sections": ["overview", "usage"]
    },
    {
      "path": "cmd/indexion/plan/reconcile",
      "title": "plan reconcile",
      "include_in_root": true,
      "sections": ["overview", "usage"]
    },
    {
      "path": "cmd/indexion/plan/solid",
      "title": "plan solid",
      "include_in_root": true,
      "sections": ["overview", "usage"]
    },
    {
      "path": "cmd/indexion/plan/unwrap",
      "title": "plan unwrap",
      "include_in_root": true,
      "sections": ["overview", "usage"]
    },
    {
      "path": "cmd/indexion/plan/drift",
      "title": "plan drift",
      "include_in_root": true,
      "sections": ["overview", "usage"]
    },
    {
      "path": "cmd/indexion/digest",
      "title": "digest",
      "include_in_root": true,
      "sections": ["overview", "usage"]
    },
    {
      "path": "cmd/indexion/serve",
      "title": "serve",
      "include_in_root": true,
      "sections": ["overview", "usage"]
    },
    {
      "path": "cmd/indexion/mcp",
      "title": "mcp",
      "include_in_root": true,
      "sections": ["overview", "usage"]
    },
    {
      "path": "cmd/indexion/kgf",
      "title": "kgf",
      "include_in_root": true,
      "sections": ["overview", "usage"]
    },
    {
      "path": "cmd/indexion/wiki",
      "title": "wiki",
      "include_in_root": true,
      "sections": ["overview", "usage"]
    },
    {
      "path": "cmd/indexion/spec",
      "title": "spec",
      "include_in_root": true,
      "sections": ["overview", "usage"]
    }
  ],
  "root": {
    "output": "README.mbt.md",
    "sections": [
      { "type": "static", "file": "docs/intro.md" },
      { "type": "toc", "title": "Commands" },
      { "type": "packages", "filter": "cmd/**" },
      { "type": "static", "file": "docs/installation.md" },
      { "type": "static", "file": "docs/documentation.md" },
      { "type": "static", "file": "docs/license.md" }
    ]
  }
}
